input,output,category
What is intellectual property?,"Intellectual property (IP) refers to creations of the mind, such as inventions, literary works, designs, and symbols used in commerce. It includes patents, trademarks, copyrights, and trade secrets, which can be legally protected.",legal
What is a contract?,"A contract is a legally binding agreement between two or more parties that creates obligations enforceable by law. It requires offer, acceptance, consideration, legal capacity, and lawful purpose to be valid.",legal
What are employment rights?,"Employment rights include fair wages, safe working conditions, protection from discrimination, right to organize, reasonable working hours, and protection from wrongful termination. These vary by jurisdiction and may be governed by labor laws.",legal
What is data protection law?,"Data protection laws govern how personal information is collected, processed, stored, and shared. Examples include GDPR in Europe and CCPA in California. These laws give individuals rights over their personal data and impose obligations on organizations.",legal
What is due process?,"Due process is a fundamental legal principle ensuring fair treatment through the judicial system. It includes the right to a fair hearing, legal representation, presumption of innocence, and protection from arbitrary government action.",legal
